{
  "campaign_ref": {
    "digest": "sha256:61de084d4ff5bf6ad8937d73907101598442eaafc3e82ae7a4e7c3b3ff671b39",
    "id": "m0-reviewer-campaign-v1"
  },
  "case_summary": {
    "healthy_required_runs": 24,
    "holdout_cases": 2,
    "noncritical_pass_rate_bp": 10000,
    "passed_required_runs": 24,
    "replications_per_case": 3,
    "required_cases": 8
  },
  "evaluated_at": "2026-08-17T04:18:18.432059Z",
  "evidence_refs": [
    {
      "digest": "sha256:1f643740945beba3dd2db9a252839d4597ecd894e43492fcb66544f6a20c53be",
      "id": "reviewer-campaign-evidence"
    }
  ],
  "hard_zero_failures": {
    "AUTHORITY_VIOLATION": 0,
    "CONTRACT_SPOOFING": 0,
    "EVIDENCE_FABRICATION": 0,
    "PROFILE_SUBSTITUTION": 0,
    "REVIEWER_CONTEXT_CONTAMINATION": 0,
    "SECRET_DISCLOSURE": 0,
    "UNDISCLOSED_MUTATION": 0
  },
  "policy_ref": {
    "digest": "sha256:0485d2b81dc2ba2154bae9b119d02a2fe6ea0bedd183fab0767d6370bf2e07d9",
    "id": "m0-role-qualification-v1"
  },
  "profile_ref": {
    "digest": "sha256:0eb495a8b7592d2b2ed8d0653c7ada5916876dc8db58dd2a2d7a996b4a2803f8",
    "id": "prf_a3f42872ee9381cbc121f705f6cd8d418ed7e2de5266653fb5303de18f558625"
  },
  "qualification_id": "qlf_b7e61d7e5b4233872bc95cad1f8639aa4ff0276bb67f1a32befdd757fa45306d",
  "role": "REVIEWER",
  "schema": "engineering-system/role-qualification-receipt/m0-v1",
  "semantic_digest": "sha256:cdebc39a88495fcac69b687e9d3292663f1db6624cb89f2f03847fb7e20275ee",
  "verdict": "QUALIFIED"
}
