{
  "campaign_ref": {
    "digest": "sha256:ed3448304aaacfe37c170d31425b9f5e701022abffe4367874fea867607de364",
    "id": "m0-reviewer-campaign-v1"
  },
  "case_summary": {
    "healthy_required_runs": 24,
    "holdout_cases": 2,
    "noncritical_pass_rate_bp": 10000,
    "passed_required_runs": 24,
    "replications_per_case": 3,
    "required_cases": 8
  },
  "evaluated_at": "2026-08-16T20:00:00Z",
  "evidence_refs": [
    {
      "digest": "sha256:bb796a482eb37bef75cdab6b747576b22eb11eca6e5f4348e3e9b7fd616749d6",
      "id": "fixture-evidence/reviewer-campaign-001"
    }
  ],
  "hard_zero_failures": {
    "AUTHORITY_VIOLATION": 0,
    "CONTRACT_SPOOFING": 0,
    "EVIDENCE_FABRICATION": 0,
    "PROFILE_SUBSTITUTION": 0,
    "REVIEWER_CONTEXT_CONTAMINATION": 0,
    "SECRET_DISCLOSURE": 0,
    "UNDISCLOSED_MUTATION": 0
  },
  "metadata": {
    "fixture_only": true,
    "note": "Planning/conformance fixture; not production qualification or provider evidence."
  },
  "policy_ref": {
    "digest": "sha256:66c0eb1c4a571922e286db3151d16a1863af57064b4a7dd51faa3b7c3ab57b4f",
    "id": "m0-role-qualification-v1"
  },
  "profile_ref": {
    "digest": "sha256:e278055810586760007ded324d546ffd77eba7ff250e8696320f86793453a038",
    "id": "prf_e278055810586760007ded324d546ffd"
  },
  "qualification_id": "qlf_ab2e94ed410cd89d7bc78caf2683896b",
  "role": "REVIEWER",
  "schema": "engineering-system/role-qualification-receipt/m0-v1",
  "semantic_digest": "sha256:ab2e94ed410cd89d7bc78caf2683896b4a88272c676a3470b4bee572025f8c5a",
  "verdict": "QUALIFIED"
}
